{"$schema":"https://json-schema.org/draft/2020-12/schema","$id":"https://cps.local/schemas/structural_sampler_request_1_1.schema.json","title":"StructuralSamplerRequest v1.1","type":"object","additionalProperties":false,"required":["schema","schema_version","run_hash","context_hash","source_decision_hash","sampler_manifest_hash","structural_lowering_manifest_hash","structural_program_schema_hash","structural_rejection_evidence_schema_hash","root_seed","cohort_index","request_hash"],"properties":{"schema":{"const":"cps.structural-sampler-request"},"schema_version":{"const":"1.1.0"},"run_hash":{"$ref":"#/$defs/sha"},"context_hash":{"$ref":"#/$defs/sha"},"source_decision_hash":{"$ref":"#/$defs/sha"},"sampler_manifest_hash":{"$ref":"#/$defs/sha"},"structural_lowering_manifest_hash":{"$ref":"#/$defs/sha"},"structural_program_schema_hash":{"$ref":"#/$defs/sha"},"structural_rejection_evidence_schema_hash":{"$ref":"#/$defs/sha"},"root_seed":{"$ref":"#/$defs/u64"},"cohort_index":{"$ref":"#/$defs/u64"},"request_hash":{"$ref":"#/$defs/sha"}},"$defs":{"sha":{"type":"string","pattern":"^sha256:[0-9a-f]{64}$"},"u64":{"type":"integer","minimum":0,"maximum":18446744073709551615}}}
